{
  "schemaVersion": "1.0.0",
  "reportId": "report_BTRREPORT001",
  "runId": "mig_PORTFOLIO0001",
  "sourceId": "ebs",
  "sourceManifestDigest": "sha256:3030303030303030303030303030303030303030303030303030303030303030",
  "deterministicCheck": {"engine": "deterministic-pii-rules", "rulesetVersion": "1.0.0", "status": "passed", "findingCount": 2, "categoryCounts": {"name": 1, "email": 0, "phone": 1, "address": 0, "governmentId": 0, "financialAccount": 0, "other": 0}, "evidenceDigest": "sha256:4343434343434343434343434343434343434343434343434343434343434343"},
  "localGemmaCheck": {"model": "gemma-3-4b-it", "executionLocation": "edge-local", "status": "passed", "findingCount": 0, "categoryCounts": {"name": 0, "email": 0, "phone": 0, "address": 0, "governmentId": 0, "financialAccount": 0, "other": 0}, "evidenceDigest": "sha256:5353535353535353535353535353535353535353535353535353535353535353"},
  "unresolvedFindingCount": 0,
  "status": "passed",
  "failClosed": true,
  "reportDigest": "sha256:6363636363636363636363636363636363636363636363636363636363636363",
  "completedAt": "2026-08-26T14:01:12Z"
}
